{
  "vertical": "restoration",
  "version": 1,
  "effective_from": "2026-08-01",
  "verified": false,
  "emergency_triggers": [
    {
      "code": "ACTIVE_WATER_INTRUSION",
      "severity": "escalate_now",
      "phrases": [
        "water intrusion",
        "water coming in",
        "water in the house",
        "active water",
        "still taking on water",
        "water coming through"
      ]
    }
  ],
  "required_capture": ["name", "address", "callback", "problem", "urgency", "source"],
  "never_say": ["price", "estimate_range", "hourly_rate", "arrival_time"],
  "fixtures": ["restoration_active_water.json"]
}
